"headline","link"
"Retired nun 'sad' that Cardinal Mahony will vote on next pope","http://latimesblogs.latimes.com/lanow/2013/02/cardinal-mahony-pope-reaction.html"
"Cardinal Mahony used cemetery money to pay sex abuse settlement","http://www.latimes.com/news/local/la-me-church-cemetery-fund-20130210,0,1768358.story"
"L.A. archbishop calls pope's retirement an 'act of humility'","http://latimesblogs.latimes.com/lanow/2013/02/la-archbishop-pope-retirement.html"
"Cardinal Mahony says he wasn't equipped to handle priest abuse","http://latimesblogs.latimes.com/lanow/2013/02/cardinal-mahony-priest-abuse.html"
"Cardinal Mahony's removal not enough, church critics say","http://latimesblogs.latimes.com/lanow/2013/02/cardinal-mahonys-removal-not-enough-church-critics-say.html"
"Cardinal Mahony's priest abuse defense sparks criticism","http://latimesblogs.latimes.com/lanow/2013/02/cardinal-mahonys-priest-abuse-defense-sparks-criticism.html"
"Cardinal Mahony removed from public church duties","http://latimesblogs.latimes.com/lanow/2013/01/cardinal-mahony-stripped-of-public-church-duties-amid-priest-abuse-.html"
"Rebuke of Cardinal Mahony casts a lengthy shadow at L.A. churches","http://latimesblogs.latimes.com/lanow/2013/02/cardinal-mahony-los-angeles-churches.html"
"Steve Lopez: How can Mahony still be a priest 'in good standing'?","http://latimesblogs.latimes.com/lanow/2013/02/steve-lopez-cardinal-mahony-abuse.html"
"Cardinal Mahony rebuked as more 'brutal' priest abuse files released","http://latimesblogs.latimes.com/lanow/2013/02/cardinal-mahony-priest-abuse-files.html"
"Archbishop takes action on Mahony, Curry over abuse scandal","http://latimesblogs.latimes.com/lanow/2013/01/archbishop-takes-action-on-mahony-curry-over-abuse-scandal.html"
"Church abuse: Action against Cardinal Mahony 'extraordinary'","http://latimesblogs.latimes.com/lanow/2013/01/church-abuse-action-against-cardinal-mahony-extraordinary.html"
"L.A. Now Live: Discuss priest abuse, Cardinal Mahony's legacy","http://latimesblogs.latimes.com/lanow/2013/02/la-now-live-feb-1.html"
"Mahony defends actions in abuse cases","http://www.latimes.com/news/local/la-me-mahony-church-20130202,0,5622288.story"
"Cardinal Mahony's deal with the devil","http://www.latimes.com/news/local/la-me-0203-lopez-mahony-20130203,0,612758.column"
"Cardinal Mahony relieved of duties over handling of abuse","http://www.latimes.com/news/local/la-me-0201-mahony-curry-20130201,0,3889565.story"
"A sudden fall for Cardinal Mahony's former right-hand man","http://www.latimes.com/news/local/la-me-adv-church-curry-20130203,0,5584406.story"
"Letters: Cardinal Mahony's shaky defense","http://www.latimes.com/news/opinion/letters/la-le-0205-tuesday-mahony-defense-20130205,0,5957901.story"
"A somber mood as parishioners discuss action against Mahony","http://www.latimes.com/news/local/la-me-church-react-20130201,0,1148545.story"
"Action against Cardinal Mahony: Readers aren't impressed","http://www.latimes.com/news/opinion/opinion-la/la-ol-mahony-gomez-mailbag-20120201,0,705928.story"
"'I am sorry,' Cardinal Mahony says amid new priest abuse details","http://latimesblogs.latimes.com/lanow/2013/01/cardinal-mahony-priest-abuse-details.html"
"Steve Lopez: It's too late for Cardinal Roger Mahony's apologies","http://latimesblogs.latimes.com/lanow/2013/01/steve-lopez-roger-mahony.html"
"Cardinal Mahony letter to Archbishop Gomez","http://documents.latimes.com/cardinal-mahony-letter-archbishop-gomez/"
"Mahony's efforts to hide abuse are deplorable but unsurprising","http://www.latimes.com/news/local/la-me-0123-lopez-mahony-20130123,0,2185624.column"
"Mishandling of abuse cases threatens Mahony's legacy with Latinos","http://www.latimes.com/news/local/la-me-mahony-latinos-20130127,0,4979627.story"
"Cardinal Mahony's moral failure","http://www.latimes.com/news/opinion/opinion-la/la-ol-mahony-sex-abuse-20130122,0,6143220.story"
"Letters: Mahony's legacy","http://www.latimes.com/news/opinion/letters/la-le-0129-tuesday-mahony-legacy-20130129,0,2203967.story"
"Letters: Mahony's moral obligations","http://www.latimes.com/news/opinion/letters/la-le-0124-thursday-mahony-abuse-20130124,0,4816211.story"
"For the record","http://www.latimes.com/news/custom/corrections/la-a4-correx-20130210,0,3821823.story"
"Talk back: Amid scandal, would you donate to L.A. archdiocese?","http://latimesblogs.latimes.com/lanow/2013/02/amid-abuse-scandal-would-you-donate-to-the-la-archdiocese.html"
"Sex abuse scandal is a blemish on the powerful Catholic clergy","http://www.latimes.com/news/politics/topoftheticket/la-na-tt-sex-abuse-scandal-20130204,0,150544.story"
"L.A. Now Live: L.A. priest abuse files, Mahony's apology","http://latimesblogs.latimes.com/lanow/2013/01/priest-abuse-files-mahony-dto.html"
"Judge orders church to release full priest abuse records","http://latimesblogs.latimes.com/lanow/2013/01/judge-orders-church-to-release-full-priest-abuse-records.html"
"Priest abuse files strike chord for victims","http://www.latimes.com/news/local/la-me-02-04-abuse-victims-20130204,0,5425637.story"
"L.A.-area priests try to make sense of a tumultuous week","http://www.latimes.com/news/local/la-me-0204-church-fallout-20130203,0,3277929.story"
"Priests' ecclesiastical missteps treated more sternly than abuse","http://www.latimes.com/news/local/la-me-priest-files-20130202,0,2178748.story"
"Cardinal sins","http://www.latimes.com/news/opinion/editorials/la-ed-church-abuse-files-20130203,0,2401834.story"
"Priest files reveal disturbing stories of child molestation, coverup","http://latimesblogs.latimes.com/lanow/2013/02/priest-files-reveal-distrubing-stories-of-child-molestation-coverup.html"
"Letters: The fallen cardinal","http://www.latimes.com/news/opinion/letters/la-le-0203-sunday-cardinal-mahony-20130203,0,2432749.story"
"Church leaders address clergy sex abuse scandal at Sunday services","http://latimesblogs.latimes.com/lanow/2013/02/church-leaders-address-clergy-sex-abuse-scandal-at-sunday-services.html"
"Church sex abuse scandal brings reflection at L.A. congregations","http://latimesblogs.latimes.com/lanow/2013/02/priest-molestations-bring-reflection-at-la-churches.html"
"Letters: The church's contrition","http://www.latimes.com/news/opinion/letters/la-le-0206-wednesday-abuse-scandal-20130206,0,1393344.story"
"L.A. priest abuse: 'These are tough days,' Msgr. Kevin Kostelnik says","http://latimesblogs.latimes.com/lanow/2013/02/la-priest-abuse-these-are-tough-days-msgr-kevin-kostelnik-says.html"
"Review: 'Mea Maxima Culpa' looks at Catholic Church's abuse cover-up","http://www.latimes.com/entertainment/tv/showtracker/la-et-st-mea-maxima-culpa-20130204,0,6297138.story"
"L.A. Archdiocese considers $200-million fund drive amid scandal","http://www.latimes.com/news/local/la-me-archdiocese-capital-20130206,0,3202095.story"
"LAPD detectives investigate newly disclosed priest abuse files","http://latimesblogs.latimes.com/lanow/2013/02/lapd-launches-new-probe-of-priest-molestation-records-.html"
"One side, then the other from Times readers","http://www.latimes.com/news/opinion/letters/la-le-0202-lettersonletters-ballona-mahony-20130202,0,3390305.story"
"Amid molestation scandal, archdiocese mulls $200-million fund-raiser","http://latimesblogs.latimes.com/lanow/2013/02/archdiocese-fund-raiser.html"
